{
  "$schema": "https://json-schema.org/draft/2020-12/schema",
  "$id": "https://governseed.example/schemas/autonomous-completion-delegation-manifest-v4.schema.json",
  "title": "GovernSeed autonomous completion delegation V4 fail-closed preparation",
  "type": "object",
  "additionalProperties": false,
  "required": [
    "schemaVersion",
    "manifestId",
    "status",
    "repository",
    "experimentId",
    "experimentRevision",
    "previousManifest",
    "canonicalContract",
    "preparationAuthorization",
    "quotaReadinessAttestation",
    "immutableG2FailureAccounting",
    "activationProposal",
    "ceilingRevision",
    "unchangedContractSections",
    "workflowRevision",
    "providerAndCostRevision",
    "mandatoryStops",
    "authorityBoundary",
    "selfBinding"
  ],
  "properties": {
    "schemaVersion": { "const": 4 },
    "manifestId": { "const": "GS-EFFECT-R2-AUTONOMOUS-COMPLETION-DELEGATION-V4" },
    "status": { "const": "PENDING_EXACT_OWNER_APPROVAL_BINDING" },
    "repository": { "const": "Eskasia/governseed" },
    "experimentId": { "const": "GS-OSS-2026-08-05-EFFECT-R2" },
    "experimentRevision": { "const": 2 },
    "previousManifest": { "type": "object" },
    "canonicalContract": { "type": "object" },
    "preparationAuthorization": { "type": "object" },
    "quotaReadinessAttestation": { "type": "object" },
    "immutableG2FailureAccounting": { "type": "object" },
    "activationProposal": { "type": "object" },
    "ceilingRevision": { "type": "object" },
    "unchangedContractSections": { "type": "array", "minItems": 1, "uniqueItems": true },
    "workflowRevision": { "type": "object" },
    "providerAndCostRevision": { "type": "object" },
    "mandatoryStops": { "type": "array", "minItems": 1, "uniqueItems": true },
    "authorityBoundary": { "type": "object" },
    "selfBinding": { "type": "string", "minLength": 1 }
  }
}
